{
  "schema_version": "1.0.0",
  "dataset_id": "hiking:jawa-barat:cikuray",
  "research_date": "2026-10-30",
  "locale": "id-ID",
  "status": "pilot_research_complete_reviewable",
  "publishable": false,
  "mountain": {
    "slug": "cikuray",
    "name": "Gunung Cikuray",
    "aliases": [
      "Cikurai",
      "Puncak Ribu"
    ],
    "administrative_area": {
      "province": "Jawa Barat",
      "regency": "Garut",
      "local_areas_referenced": [
        "Cilawu",
        "Bayongbong",
        "Cigedug",
        "Cikajang"
      ]
    },
    "elevation": {
      "value_m": 2821,
      "verification": "cross_source_reference",
      "source_ids": [
        "S01",
        "S06",
        "S10"
      ],
      "notes": "Angka 2.821 mdpl muncul pada publikasi Badan Geologi dan sumber kartografis/turisme. Bukan hasil survei elevasi yang dilakukan dalam pilot ini."
    },
    "summit_location": {
      "latitude": -7.32257537,
      "longitude": 107.85979869,
      "source_label": "PUNCAK CIKURAI 2821M",
      "source_ids": [
        "S05"
      ],
      "verification": "source_waypoint_not_official_survey"
    },
    "geology": {
      "landform_type": "stratovolcano",
      "summary": "Publikasi Badan Geologi menguraikan kompleks Karacak–Cikuray sebagai bentang alam vulkanik, dengan satuan lava andesit, breksi piroklastika dan endapan lahar. Publikasi tersebut menyebut Khuluk Cikuray sebagai bagian dari gunung api muda Kuarter.",
      "current_volcanic_status": "unknown",
      "status_note": "Keterangan geologi historis bukan pemantauan aktivitas vulkanik terkini. Status operasional/aktivitas harus mengacu pada informasi PVMBG bila diperlukan.",
      "source_ids": [
        "S01",
        "S10"
      ]
    },
    "editorial": {
      "short_description": "Gunung Cikuray merupakan puncak setinggi sekitar 2.821 mdpl di Kabupaten Garut, Jawa Barat. Bentuk kerucut vulkaniknya menjadi penanda lanskap Garut, sementara beberapa koridor pendakian menghubungkan lereng perkebunan, lahan pertanian, hutan pegunungan, hingga punggungan puncak.",
      "overview": "Karakter pendakian Cikuray berbeda menurut titik awal. Jalur Pemancar/Cilawu dimulai dari kawasan perkebunan teh sebelum memasuki hutan; akses Cikajang melalui Carik atau Olan melewati lahan pertanian dan hutan pinus; sedangkan jalur Bayongbong/Pamalayan dan Tapak Gerot/Cigedug memiliki pendekatan dan titik pertemuan jalur yang berbeda. Publikasi Badan Geologi menggambarkan beberapa bagian jalur sebagai curam atau menanjak, dan mencatat bahwa angin di area puncak dapat bertiup kuat. Pendaki perlu memilih rute berdasarkan informasi pengelola, bukan semata-mata nama track pada arsip GPX.",
      "route_context": "Perhutani KPH Garut pada 2025 menyebut Pemancar, Cintanagara dan Tapak Gerot sebagai tiga jalur resmi yang direkomendasikan. Publikasi Badan Geologi 2023 juga mendokumentasikan beberapa rute lain, antara lain Cikajang, Pamalayan/Bayongbong dan Kiara Janggot. Kedua sumber menggambarkan konteks dan waktu yang berbeda; daftar historis tidak otomatis berarti jalur masih beroperasi. Perlu diperhatikan bahwa Surat Edaran Gubernur Jawa Barat 30 Agustus 2026 melarang aktivitas pendakian gunung/hutan di Jawa Barat selama musim kemarau. Laporan media yang menyebut pembukaan kembali dua jalur pada awal Oktober belum didukung pencabutan atau pengecualian tertulis yang ditemukan dalam riset ini.",
      "safety_note": "Aktivitas pendakian di Jawa Barat terkena Surat Edaran Gubernur Jawa Barat Nomor 116/KH.02.04.03/ASDA EKBANG tanggal 30 Agustus 2026 yang melarang pendakian gunung/hutan selama musim kemarau. Pada riset 30 Oktober 2026 belum ditemukan pencabutan atau pengecualian tertulis untuk jalur Cikuray. Laporan media tentang pembukaan Pemancar dan Cintanagara pada awal Oktober bertentangan dengan pembatasan tersebut dan belum menjadi bukti izin tertulis. Status jalur tidak boleh ditampilkan sebagai dibuka sebelum dikonfirmasi kepada pihak berwenang. Angin di puncak juga dilaporkan dapat bertiup kuat.",
      "source_ids": [
        "S01",
        "S02",
        "S03",
        "S05",
        "S07",
        "S08",
        "S09",
        "S10"
      ]
    },
    "claims": [
      {
        "field": "elevation.value_m",
        "value": 2821,
        "status": "cross_source_reference",
        "source_ids": [
          "S01",
          "S06",
          "S10"
        ]
      },
      {
        "field": "geology.landform_type",
        "value": "stratovolcano",
        "status": "official_publication_supported",
        "source_ids": [
          "S01",
          "S10"
        ]
      },
      {
        "field": "administrative_area.regency",
        "value": "Garut",
        "status": "cross_source_reference",
        "source_ids": [
          "S01",
          "S02",
          "S10"
        ]
      },
      {
        "field": "summit_location",
        "value": [
          -7.32257537,
          107.85979869
        ],
        "status": "community_archive_waypoint",
        "source_ids": [
          "S05"
        ]
      },
      {
        "field": "operational_status",
        "value": "route_specific_and_time_sensitive",
        "status": "must_reconfirm",
        "source_ids": [
          "S07",
          "S08",
          "S09"
        ]
      }
    ]
  },
  "routes": [
    {
      "id": "pemancar-cilawu",
      "names": [
        "Pemancar",
        "Cilawu",
        "Dayeuhmanggung"
      ],
      "manager_recognition": {
        "status": "recommended_official_route",
        "source_ids": [
          "S03"
        ]
      },
      "operational_status": {
        "status": "restriction_applies_pending_written_clearance",
        "legal_basis": {
          "instrument": "Surat Edaran Gubernur Jawa Barat Nomor 116/KH.02.04.03/ASDA EKBANG",
          "issued_at": "2026-08-30",
          "scope": "Larangan seluruh aktivitas pendakian gunung/hutan di wilayah Jawa Barat selama musim kemarau dan aktivitas lain yang berisiko memantik kebakaran.",
          "source_ids": [
            "S12",
            "S13",
            "S14"
          ],
          "signed_copy_status": "not_independently_retrieved",
          "revocation_or_route_exception_found_by": "2026-10-30",
          "revocation_or_route_exception_status": "not_found_in_research"
        },
        "operator_confirmation": {
          "status": "not_obtained",
          "required_before_publishing_open_status": true
        },
        "display_guidance": "Jangan tampilkan jalur sebagai dibuka hanya berdasarkan laporan media. Tampilkan bahwa larangan provinsi belum ditemukan pencabutannya dan minta pengunjung memeriksa surat klarifikasi/izin tertulis dari pihak berwenang.",
        "last_researched_at": "2026-10-30",
        "reconfirm_before_departure": true,
        "route_specific_report": {
          "status": "media_reported_reopening",
          "date": "2026-10-04",
          "source_ids": [
            "S08"
          ],
          "weight": "secondary_report_not_written_clearance"
        },
        "previous_operational_assessment": "reported_open"
      },
      "recorded_track_id": "cikuray-track-002",
      "basecamp_id": "pemancar-cilawu",
      "profile": {
        "trailhead_elevation_m": 1510,
        "ascent_time_hours": [
          5,
          8
        ],
        "checkpoints": [
          {
            "name": "Pos 1 / Pemancar",
            "elevation_m": 1510
          },
          {
            "name": "Pos 2",
            "elevation_m": 1950
          },
          {
            "name": "Pos 3",
            "elevation_m": 2275
          },
          {
            "name": "Pos 4",
            "elevation_m": 2310
          },
          {
            "name": "Pos 5",
            "elevation_m": 2420
          },
          {
            "name": "Pos 6",
            "elevation_m": 2530
          },
          {
            "name": "Pos 7",
            "elevation_m": 2750
          }
        ],
        "terrain": "Pendakian dimulai di area perkebunan teh, kemudian mencapai tepi hutan; bagian hutan digambarkan cukup curam. Beberapa area disebut dapat digunakan untuk berkemah.",
        "source_ids": [
          "S01"
        ]
      },
      "source_ids": [
        "S01",
        "S02",
        "S03",
        "S05",
        "S08"
      ]
    },
    {
      "id": "cintanagara",
      "names": [
        "Cintanagara",
        "Cinta Nagara"
      ],
      "manager_recognition": {
        "status": "recommended_official_route",
        "source_ids": [
          "S03"
        ]
      },
      "operational_status": {
        "status": "restriction_applies_pending_written_clearance",
        "legal_basis": {
          "instrument": "Surat Edaran Gubernur Jawa Barat Nomor 116/KH.02.04.03/ASDA EKBANG",
          "issued_at": "2026-08-30",
          "scope": "Larangan seluruh aktivitas pendakian gunung/hutan di wilayah Jawa Barat selama musim kemarau dan aktivitas lain yang berisiko memantik kebakaran.",
          "source_ids": [
            "S12",
            "S13",
            "S14"
          ],
          "signed_copy_status": "not_independently_retrieved",
          "revocation_or_route_exception_found_by": "2026-10-30",
          "revocation_or_route_exception_status": "not_found_in_research"
        },
        "operator_confirmation": {
          "status": "not_obtained",
          "required_before_publishing_open_status": true
        },
        "display_guidance": "Jangan tampilkan jalur sebagai dibuka hanya berdasarkan laporan media. Tampilkan bahwa larangan provinsi belum ditemukan pencabutannya dan minta pengunjung memeriksa surat klarifikasi/izin tertulis dari pihak berwenang.",
        "last_researched_at": "2026-10-30",
        "reconfirm_before_departure": true,
        "route_specific_report": {
          "status": "media_reported_reopening",
          "date": "2026-10-02",
          "source_ids": [
            "S07"
          ],
          "weight": "secondary_report_not_written_clearance"